{
  "$schema": "../schemas/pack.schema.json",
  "slug": "backend-data",
  "status": "active",
  "featured": false,
  "color": "violet",
  "version": "1.1.0",
  "skills": [
    "designing-relational-data-models",
    "building-reliable-node-api-boundaries",
    "evolving-postgres-schemas-safely",
    "profiling-postgres-query-performance"
  ],
  "locales": {
    "en": {
      "name": "Backend & Data",
      "summary": "Data modeling, Node.js service boundaries, safe schema evolution, and PostgreSQL performance for dependable backend systems.",
      "description": "An installable workflow for shaping relational models, implementing explicit API boundaries, evolving live PostgreSQL schemas safely, and diagnosing query performance with evidence.",
      "outcomes": [
        "Design data and service boundaries that encode invariants and authorization explicitly",
        "Evolve and tune PostgreSQL systems with measured migration and query evidence"
      ]
    },
    "pt-BR": {
      "name": "Backend e Dados",
      "summary": "Modelagem de dados, limites de serviços Node.js, evolução segura de schemas e performance PostgreSQL para backends confiáveis.",
      "description": "Um fluxo instalável para estruturar modelos relacionais, implementar limites explícitos de API, evoluir schemas PostgreSQL ativos com segurança e diagnosticar performance de queries com evidências.",
      "outcomes": [
        "Projetar limites de dados e serviços que expressem invariantes e autorização de forma explícita",
        "Evoluir e otimizar sistemas PostgreSQL com evidências de migrations e queries"
      ]
    }
  }
}
