{
  "$schema": "../schemas/pack.schema.json",
  "slug": "game-development",
  "status": "active",
  "featured": true,
  "color": "amber",
  "version": "1.1.0",
  "skills": [
    "designing-action-combat",
    "building-hybrid-game-assets",
    "creating-character-sprite-pipelines",
    "sprite-gen",
    "reconstructing-images-as-threejs",
    "testing-playable-games"
  ],
  "locales": {
    "en": {
      "name": "Game Development",
      "summary": "Combat design, executable sprite production, character animation, procedural 3D, and playable-build verification.",
      "description": "An end-to-end workflow for defining readable action combat, producing and exporting coherent runtime sprites and hybrid assets, evaluating procedural 3D, and testing features through real gameplay sequences.",
      "outcomes": [
        "Create readable combat supported by consistent, runtime-ready assets",
        "Verify gameplay, animation, progression, and performance before release"
      ]
    },
    "pt-BR": {
      "name": "Desenvolvimento de Jogos",
      "summary": "Design de combate, produção executável de sprites, animação de personagens, 3D procedural e verificação de builds jogáveis.",
      "description": "Um fluxo completo para definir combate de ação legível, produzir e exportar sprites e assets híbridos coerentes para runtime, avaliar 3D procedural e testar funcionalidades em sequências reais de gameplay.",
      "outcomes": [
        "Criar combate legível apoiado por assets consistentes e prontos para runtime",
        "Verificar gameplay, animação, progressão e performance antes da entrega"
      ]
    }
  }
}
