{
  "$schema": "../schemas/pack.schema.json",
  "slug": "frontend-product",
  "status": "active",
  "featured": true,
  "color": "electric-blue",
  "version": "1.1.0",
  "skills": [
    "bootstrapping-modern-web-apps",
    "designing-ui-systems",
    "art-directing-web-interfaces",
    "building-premium-nextjs-interfaces",
    "building-conversion-product-pages",
    "translating-figma-to-nextjs",
    "implementing-reference-faithful-ui",
    "auditing-pixel-perfect-frontend",
    "reviewing-apple-platform-interfaces",
    "shipping-github-vercel-changes"
  ],
  "locales": {
    "en": {
      "name": "Frontend & Product",
      "summary": "Product strategy, art direction, interface systems, implementation fidelity, Apple platform review, and delivery.",
      "description": "Establish a web application baseline, choose a product-specific art direction, shape interface systems, translate references into responsive code, audit fidelity, and prepare verified changes for release. When the product targets iOS, iPadOS, or macOS, review its interface against current official Apple guidance with a dedicated method.",
      "outcomes": [
        "Build coherent, accessible, and conversion-aware product interfaces",
        "Move reference-backed frontend work from setup through verified delivery",
        "Identify actionable accessibility and platform convention fixes in Apple apps"
      ]
    },
    "pt-BR": {
      "name": "Frontend e Produto",
      "summary": "Estratégia de produto, direção de arte, sistemas de interface, fidelidade de implementação, revisão para plataformas Apple e entrega.",
      "description": "Estabeleça a base de uma aplicação web, escolha uma direção de arte própria do produto, defina sistemas de interface, traduza referências em código responsivo, audite a fidelidade e prepare mudanças verificadas para entrega. Quando o produto for destinado a iOS, iPadOS ou macOS, revise sua interface pelas diretrizes oficiais atuais da Apple com um método próprio.",
      "outcomes": [
        "Construir interfaces de produto coerentes, acessíveis e orientadas à conversão",
        "Levar trabalhos de frontend baseados em referências da preparação à entrega verificada",
        "Identificar correções acionáveis de acessibilidade e convenções de plataforma em apps Apple"
      ]
    }
  }
}
